<selectbf-config xmlns:xsi="http://www.w3.org/2001/XMLSchema-instance" xsi:noNamespaceSchemaLocation="http://www.selectbf.org/xsd/selectbf-config.xsd">
 <!--DATABASE CONFIGURATION-->
 <database user="${DB_USER}" password="${DB_PASSWORD}" database="${DB_DATABASE}" port="${DB_PORT}">mariadb</database>

 <!--FILE MANAGEMENT-->
 <after-parsing>archive</after-parsing>
 <archive-folder>/app/logs/archive</archive-folder>
 <after-download>remain</after-download>
 <delete-decompressed-xml-files>false</delete-decompressed-xml-files>
 <rename-at-error>false</rename-at-error>
 
 <!--DATA MANAGEMENT-->
 <log-bots>false</log-bots>
 <trim-database days="5" keep-players="false">false</trim-database>
 <skip-empty-rounds>true</skip-empty-rounds>
 <lan-mode>true</lan-mode>
 
 <!--OTHER STUFF-->
 <consistency-check>true</consistency-check>
 <memory-safer>true</memory-safer>
 
 <!--LOG SOURCES-->
 <!-- 
 	PLEASE NOTE: None of these are mandatory, if you don't want a source, delete it.
 	Also you can add as much sources as you want.
 --> 	
 <logs>
  <dir live="false">/app/logs</dir>
 </logs>
</selectbf-config>
